DVB Network Interface Manager
Copyright (C) 2003, TV Files S.p.A

Status: device dvb0_0 for pid 43 created successfully.
osmc@osmc:~$ sudo tcpdump -i dvb0_0
tcpdump: verbose output suppressed, use -v or -vv for full protocol decode
listening on dvb0_0, link-type EN10MB (Ethernet), capture size 262144 bytes
09:05:39.497826 IP 10.4.20.31.49463 > 224.0.255.160.5500: UDP, length 1316
09:05:39.497869 IP 10.4.20.31.41985 > 224.0.255.113.5500: UDP, length 1316
09:05:39.498279 IP 10.4.20.31.33411 > 224.0.255.115.5500: UDP, length 1316
09:05:39.498333 IP 10.4.20.31.47086 > 224.0.255.114.5500: UDP, length 1316
09:05:39.498738 IP 10.4.20.31.37213 > 224.0.255.116.5500: UDP, length 1316
09:05:39.498782 IP 10.4.20.31.37525 > 224.0.255.117.5500: UDP, length 1316
09:05:39.499175 IP 10.4.20.31.54703 > 224.0.255.145.5500: UDP, length 1316
09:05:39.499228 IP 10.4.20.31.36252 > 224.0.255.121.5500: UDP, length 1316
09:05:39.499633 IP 10.4.20.31.44786 > 224.0.255.122.5500: UDP, length 1316
09:05:39.499680 IP 10.4.20.31.41843 > 224.0.255.126.5500: UDP, length 1316
09:05:39.500071 IP 10.4.20.31.57610 > 224.0.255.128.5500: UDP, length 1316
09:05:39.500127 IP 10.4.20.31.49213 > 224.0.255.130.5500: UDP, length 1316
09:05:39.500543 IP 10.4.20.31.56874 > 224.0.255.132.5500: UDP, length 1316
09:11:16.002346 IP 10.4.20.31.33411 > 224.0.255.115.5500: UDP, length 1316
09:11:16.002824 IP 10.4.20.31.47086 > 224.0.255.114.5500: UDP, length 1316
09:11:16.002882 IP 10.4.20.31.37213 > 224.0.255.116.5500: UDP, length 1316
